参考 http://www.ywnds.com/?p=14089#comment-5724  MySQL performance_schema系列文章

MySQL performance_schema

当前数据库版本是否支持
mysql> SELECT * FROM INFORMATION_SCHEMA.ENGINES WHERE ENGINE ='PERFORMANCE_SCHEMA';
+--------------------+---------+--------------------+--------------+------+------------+
| ENGINE             | SUPPORT | COMMENT            | TRANSACTIONS | XA   | SAVEPOINTS |
+--------------------+---------+--------------------+--------------+------+------------+
| PERFORMANCE_SCHEMA | YES     | Performance Schema | NO           | NO   | NO         |
+--------------------+---------+--------------------+--------------+------+------------+
1 row in set (0.01 sec)


show命令来查询你的数据库实例是否支持INFORMATION_SCHEMA引擎
mysql> show engines;
+--------------------+---------+----------------------------------------------------------------+--------------+------+------------+
| Engine             | Support | Comment                                                        | Transactions | XA   | Savepoints |
+--------------------+---------+----------------------------------------------------------------+--------------+------+------------+
| MEMORY             | YES     | Hash based, stored in memory, useful for temporary tables      | NO           | NO   | NO         |
| MRG_MYISAM         | YES     | Collection of identical MyISAM tables                          | NO           | NO   | NO         |
| CSV                | YES     | CSV storage engine                                             | NO           | NO   | NO         |
| FEDERATED          | NO      | Federated MySQL storage engine                                 | NULL         | NULL | NULL       |
| PERFORMANCE_SCHEMA | YES     | Performance Schema                                             | NO           | NO   | NO         |
| MyISAM             | YES     | MyISAM storage engine                                          | NO           | NO   | NO         |
| InnoDB             | DEFAULT | Supports transactions, row-level locking, and foreign keys     | YES          | YES  | YES        |
| BLACKHOLE          | YES     | /dev/null storage engine (anything you write to it disappears) | NO           | NO   | NO         |
| ARCHIVE            | YES     | Archive storage engine                                         | NO           | NO   | NO         |
+--------------------+---------+----------------------------------------------------------------+--------------+------+------------+
9 rows in set (0.00 sec)

performance_schema在5.7.x及其以上版本中默认启用（5.6.x及其以下版本默认关闭），如果要显式启用或关闭时，
我们需要使用参数performance_schema=ON|OFF设置，并在my.cnf中进行配置：

[mysqld]
performance_schema = ON  # 注意：该参数为只读参数，需要在实例启动之前设置才生效

mysql> SHOW VARIABLES LIKE 'performance_schema';
+--------------------+-------+
| Variable_name      | Value |
+--------------------+-------+
| performance_schema | ON    |
+--------------------+-------+
1 row in set (0.00 sec)

mysql> SELECT TABLE_NAME FROM INFORMATION_SCHEMA.TABLES \
    -> WHERE TABLE_SCHEMA ='performance_schema' and engine='performance_schema';
+------------------------------------------------------+
| TABLE_NAME                                           |
+------------------------------------------------------+
| accounts                                             |
| cond_instances                                       |
| data_lock_waits                                      |
| data_locks                                           |
| events_errors_summary_by_account_by_error            |
| events_errors_summary_by_host_by_error               |
| events_errors_summary_by_thread_by_error             |
| events_errors_summary_by_user_by_error               |
| events_errors_summary_global_by_error                |
| events_stages_current                                |
| events_stages_history                                |
| events_stages_history_long                           |
| events_stages_summary_by_account_by_event_name       |
| events_stages_summary_by_host_by_event_name          |
| events_stages_summary_by_thread_by_event_name        |
| events_stages_summary_by_user_by_event_name          |
| events_stages_summary_global_by_event_name           |
| events_statements_current                            |
| events_statements_histogram_by_digest                |
| events_statements_histogram_global                   |
| events_statements_history                            |
| events_statements_history_long                       |
| events_statements_summary_by_account_by_event_name   |
| events_statements_summary_by_digest                  |
| events_statements_summary_by_host_by_event_name      |
| events_statements_summary_by_program                 |
| events_statements_summary_by_thread_by_event_name    |
| events_statements_summary_by_user_by_event_name      |
| events_statements_summary_global_by_event_name       |
| events_transactions_current                          |
| events_transactions_history                          |
| events_transactions_history_long                     |
| events_transactions_summary_by_account_by_event_name |
| events_transactions_summary_by_host_by_event_name    |
| events_transactions_summary_by_thread_by_event_name  |
| events_transactions_summary_by_user_by_event_name    |
| events_transactions_summary_global_by_event_name     |
| events_waits_current                                 |
| events_waits_history                                 |
| events_waits_history_long                            |
| events_waits_summary_by_account_by_event_name        |
| events_waits_summary_by_host_by_event_name           |
| events_waits_summary_by_instance                     |
| events_waits_summary_by_thread_by_event_name         |
| events_waits_summary_by_user_by_event_name           |
| events_waits_summary_global_by_event_name            |
| file_instances                                       |
| file_summary_by_event_name                           |
| file_summary_by_instance                             |
| global_status                                        |
| global_variables                                     |
| host_cache                                           |
| hosts                                                |
| log_status                                           |
| memory_summary_by_account_by_event_name              |
| memory_summary_by_host_by_event_name                 |
| memory_summary_by_thread_by_event_name               |
| memory_summary_by_user_by_event_name                 |
| memory_summary_global_by_event_name                  |
| metadata_locks                                       |
| mutex_instances                                      |
| objects_summary_global_by_type                       |
| performance_timers                                   |
| persisted_variables                                  |
| prepared_statements_instances                        |
| replication_applier_configuration                    |
| replication_applier_filters                          |
| replication_applier_global_filters                   |
| replication_applier_status                           |
| replication_applier_status_by_coordinator            |
| replication_applier_status_by_worker                 |
| replication_connection_configuration                 |
| replication_connection_status                        |
| replication_group_member_stats                       |
| replication_group_members                            |
| rwlock_instances                                     |
| session_account_connect_attrs                        |
| session_connect_attrs                                |
| session_status                                       |
| session_variables                                    |
| setup_actors                                         |
| setup_consumers                                      |
| setup_instruments                                    |
| setup_objects                                        |
| setup_threads                                        |
| socket_instances                                     |
| socket_summary_by_event_name                         |
| socket_summary_by_instance                           |
| status_by_account                                    |
| status_by_host                                       |
| status_by_thread                                     |
| status_by_user                                       |
| table_handles                                        |
| table_io_waits_summary_by_index_usage                |
| table_io_waits_summary_by_table                      |
| table_lock_waits_summary_by_table                    |
| threads                                              |
| user_defined_functions                               |
| user_variables_by_thread                             |
| users                                                |
| variables_by_thread                                  |
| variables_info                                       |
+------------------------------------------------------+
102 rows in set (0.01 sec)


mysql> use performance_schema;
Database changed

mysql> show tables from performance_schema;
+------------------------------------------------------+
| Tables_in_performance_schema                         |
+------------------------------------------------------+
| accounts                                             |
| cond_instances                                       |
| data_lock_waits                                      |
| data_locks                                           |
| events_errors_summary_by_account_by_error            |
| events_errors_summary_by_host_by_error               |
| events_errors_summary_by_thread_by_error             |
| events_errors_summary_by_user_by_error               |
| events_errors_summary_global_by_error                |
| events_stages_current                                |
| events_stages_history                                |
| events_stages_history_long                           |
| events_stages_summary_by_account_by_event_name       |
| events_stages_summary_by_host_by_event_name          |
| events_stages_summary_by_thread_by_event_name        |
| events_stages_summary_by_user_by_event_name          |
| events_stages_summary_global_by_event_name           |
| events_statements_current                            |
| events_statements_histogram_by_digest                |
| events_statements_histogram_global                   |
| events_statements_history                            |
| events_statements_history_long                       |
| events_statements_summary_by_account_by_event_name   |
| events_statements_summary_by_digest                  |
| events_statements_summary_by_host_by_event_name      |
| events_statements_summary_by_program                 |
| events_statements_summary_by_thread_by_event_name    |
| events_statements_summary_by_user_by_event_name      |
| events_statements_summary_global_by_event_name       |
| events_transactions_current                          |
| events_transactions_history                          |
| events_transactions_history_long                     |
| events_transactions_summary_by_account_by_event_name |
| events_transactions_summary_by_host_by_event_name    |
| events_transactions_summary_by_thread_by_event_name  |
| events_transactions_summary_by_user_by_event_name    |
| events_transactions_summary_global_by_event_name     |
| events_waits_current                                 |
| events_waits_history                                 |
| events_waits_history_long                            |
| events_waits_summary_by_account_by_event_name        |
| events_waits_summary_by_host_by_event_name           |
| events_waits_summary_by_instance                     |
| events_waits_summary_by_thread_by_event_name         |
| events_waits_summary_by_user_by_event_name           |
| events_waits_summary_global_by_event_name            |
| file_instances                                       |
| file_summary_by_event_name                           |
| file_summary_by_instance                             |
| global_status                                        |
| global_variables                                     |
| host_cache                                           |
| hosts                                                |
| log_status                                           |
| memory_summary_by_account_by_event_name              |
| memory_summary_by_host_by_event_name                 |
| memory_summary_by_thread_by_event_name               |
| memory_summary_by_user_by_event_name                 |
| memory_summary_global_by_event_name                  |
| metadata_locks                                       |
| mutex_instances                                      |
| objects_summary_global_by_type                       |
| performance_timers                                   |
| persisted_variables                                  |
| prepared_statements_instances                        |
| replication_applier_configuration                    |
| replication_applier_filters                          |
| replication_applier_global_filters                   |
| replication_applier_status                           |
| replication_applier_status_by_coordinator            |
| replication_applier_status_by_worker                 |
| replication_connection_configuration                 |
| replication_connection_status                        |
| replication_group_member_stats                       |
| replication_group_members                            |
| rwlock_instances                                     |
| session_account_connect_attrs                        |
| session_connect_attrs                                |
| session_status                                       |
| session_variables                                    |
| setup_actors                                         |
| setup_consumers                                      |
| setup_instruments                                    |
| setup_objects                                        |
| setup_threads                                        |
| socket_instances                                     |
| socket_summary_by_event_name                         |
| socket_summary_by_instance                           |
| status_by_account                                    |
| status_by_host                                       |
| status_by_thread                                     |
| status_by_user                                       |
| table_handles                                        |
| table_io_waits_summary_by_index_usage                |
| table_io_waits_summary_by_table                      |
| table_lock_waits_summary_by_table                    |
| threads                                              |
| user_defined_functions                               |
| user_variables_by_thread                             |
| users                                                |
| variables_by_thread                                  |
| variables_info                                       |
+------------------------------------------------------+
102 rows in set (0.00 sec)


按照事件类型分组记录性能事件数据的表 
mysql> show tables like 'events_statement%';
+----------------------------------------------------+
| Tables_in_performance_schema (events_statement%)   |
+----------------------------------------------------+
| events_statements_current                          |
| events_statements_histogram_by_digest              |
| events_statements_histogram_global                 |
| events_statements_history                          |
| events_statements_history_long                     |
| events_statements_summary_by_account_by_event_name |
| events_statements_summary_by_digest                |
| events_statements_summary_by_host_by_event_name    |
| events_statements_summary_by_program               |
| events_statements_summary_by_thread_by_event_name  |
| events_statements_summary_by_user_by_event_name    |
| events_statements_summary_global_by_event_name     |
+----------------------------------------------------+
12 rows in set (0.00 sec)

mysql>
等待事件记录表，与语句事件类型的相关记录表类似：
mysql> show tables like 'events_wait%';
+-----------------------------------------------+
| Tables_in_performance_schema (events_wait%)   |
+-----------------------------------------------+
| events_waits_current                          |
| events_waits_history                          |
| events_waits_history_long                     |
| events_waits_summary_by_account_by_event_name |
| events_waits_summary_by_host_by_event_name    |
| events_waits_summary_by_instance              |
| events_waits_summary_by_thread_by_event_name  |
| events_waits_summary_by_user_by_event_name    |
| events_waits_summary_global_by_event_name     |
+-----------------------------------------------+
9 rows in set (0.00 sec)

mysql>
阶段事件记录表，记录语句执行的阶段事件的表，与语句事件类型的相关记录表类似：
mysql> show tables like 'events_stage%';
+------------------------------------------------+
| Tables_in_performance_schema (events_stage%)   |
+------------------------------------------------+
| events_stages_current                          |
| events_stages_history                          |
| events_stages_history_long                     |
| events_stages_summary_by_account_by_event_name |
| events_stages_summary_by_host_by_event_name    |
| events_stages_summary_by_thread_by_event_name  |
| events_stages_summary_by_user_by_event_name    |
| events_stages_summary_global_by_event_name     |
+------------------------------------------------+
8 rows in set (0.00 sec)

mysql>
事务事件记录表，记录事务相关的事件的表，与语句事件类型的相关记录表类似：
mysql> show tables like 'events_transaction%';
+------------------------------------------------------+
| Tables_in_performance_schema (events_transaction%)   |
+------------------------------------------------------+
| events_transactions_current                          |
| events_transactions_history                          |
| events_transactions_history_long                     |
| events_transactions_summary_by_account_by_event_name |
| events_transactions_summary_by_host_by_event_name    |
| events_transactions_summary_by_thread_by_event_name  |
| events_transactions_summary_by_user_by_event_name    |
| events_transactions_summary_global_by_event_name     |
+------------------------------------------------------+
8 rows in set (0.00 sec)

mysql>
mysql> show tables like 'events_transaction%';
+------------------------------------------------------+
| Tables_in_performance_schema (events_transaction%)   |
+------------------------------------------------------+
| events_transactions_current                          |
| events_transactions_history                          |
| events_transactions_history_long                     |
| events_transactions_summary_by_account_by_event_name |
| events_transactions_summary_by_host_by_event_name    |
| events_transactions_summary_by_thread_by_event_name  |
| events_transactions_summary_by_user_by_event_name    |
| events_transactions_summary_global_by_event_name     |
+------------------------------------------------------+
8 rows in set (0.00 sec)

mysql> show tables like '%file%';
+---------------------------------------+
| Tables_in_performance_schema (%file%) |
+---------------------------------------+
| file_instances                        |
| file_summary_by_event_name            |
| file_summary_by_instance              |
+---------------------------------------+
3 rows in set (0.00 sec)

mysql> show tables like '%setup%';
+----------------------------------------+
| Tables_in_performance_schema (%setup%) |
+----------------------------------------+
| setup_actors                           |
| setup_consumers                        |
| setup_instruments                      |
| setup_objects                          |
| setup_threads                          |
+----------------------------------------+
5 rows in set (0.00 sec)

mysql>

mysql> SELECT * FROM events_waits_current limit 1\G;
Empty set (0.01 sec)

ERROR:
No query specified

mysql> UPDATE setup_instruments SET ENABLED = 'YES', TIMED = 'YES' where name like 'wait%';
Query OK, 304 rows affected (0.03 sec)
Rows matched: 354  Changed: 304  Warnings: 0

mysql> UPDATE setup_consumers SET ENABLED = 'YES' where name like '%wait%';
Query OK, 3 rows affected (0.01 sec)
Rows matched: 3  Changed: 3  Warnings: 0

mysql> SELECT * FROM events_waits_current limit 1\G;
*************************** 1. row ***************************
            THREAD_ID: 14
             EVENT_ID: 52
         END_EVENT_ID: 52
           EVENT_NAME: wait/synch/mutex/innodb/buf_dblwr_mutex
               SOURCE: buf0dblwr.cc:894
          TIMER_START: 230863392550593264
            TIMER_END: 230863392551249568
           TIMER_WAIT: 656304
                SPINS: NULL
        OBJECT_SCHEMA: NULL
          OBJECT_NAME: NULL
           INDEX_NAME: NULL
          OBJECT_TYPE: NULL
OBJECT_INSTANCE_BEGIN: 2583398014056
     NESTING_EVENT_ID: NULL
   NESTING_EVENT_TYPE: NULL
            OPERATION: lock
      NUMBER_OF_BYTES: NULL
                FLAGS: NULL
1 row in set (0.01 sec)

ERROR:
No query specified

mysql> SELECT THREAD_ID,EVENT_ID,EVENT_NAME,TIMER_WAIT FROM events_waits_history ORDER BY THREAD_ID limit 21;
+-----------+----------+----------------------------------------------------+------------+
| THREAD_ID | EVENT_ID | EVENT_NAME                                         | TIMER_WAIT |
+-----------+----------+----------------------------------------------------+------------+
|        14 |      531 | wait/synch/mutex/innodb/buf_pool_flush_state_mutex |     130416 |
|        14 |      532 | wait/synch/mutex/innodb/buf_dblwr_mutex            |     748704 |
|        14 |      523 | wait/synch/mutex/innodb/buf_pool_flush_state_mutex |     125136 |
|        14 |      524 | wait/synch/mutex/innodb/buf_dblwr_mutex            |     727056 |
|        14 |      525 | wait/synch/mutex/innodb/buf_pool_flush_state_mutex |    1834272 |
|        14 |      526 | wait/synch/mutex/innodb/flush_list_mutex           |     442992 |
|        14 |      527 | wait/synch/mutex/innodb/buf_pool_flush_state_mutex |     151008 |
|        14 |      528 | wait/synch/mutex/innodb/buf_dblwr_mutex            |     780384 |
|        14 |      529 | wait/synch/mutex/innodb/buf_pool_flush_state_mutex |    1737648 |
|        14 |      530 | wait/synch/mutex/innodb/flush_list_mutex           |     439296 |
|        15 |    25241 | wait/synch/mutex/innodb/log_checkpointer_mutex     |     700656 |
|        15 |    25242 | wait/synch/mutex/innodb/flush_list_mutex           |     805200 |
|        15 |    25243 | wait/synch/mutex/innodb/log_checkpointer_mutex     |     558624 |
|        15 |    25244 | wait/synch/mutex/innodb/flush_list_mutex           |     828960 |
|        15 |    25245 | wait/synch/mutex/innodb/log_checkpointer_mutex     |     494208 |
|        15 |    25246 | wait/synch/mutex/innodb/flush_list_mutex           |     845856 |
|        15 |    25247 | wait/synch/mutex/innodb/log_checkpointer_mutex     |     549648 |
|        15 |    25248 | wait/synch/mutex/innodb/flush_list_mutex           |     926112 |
|        15 |    25249 | wait/synch/mutex/innodb/log_checkpointer_mutex     |     637296 |
|        15 |    25250 | wait/synch/mutex/innodb/flush_list_mutex           |     869616 |
|        16 |     1321 | wait/synch/mutex/innodb/log_closer_mutex           |    1118832 |
+-----------+----------+----------------------------------------------------+------------+
21 rows in set (0.01 sec)

mysql>  SELECT EVENT_NAME,COUNT_STAR FROM events_waits_summary_global_by_event_name \
    -> ORDER BY COUNT_STAR DESC LIMIT 10;
+--------------------------------------------------+------------+
| EVENT_NAME                                       | COUNT_STAR |
+--------------------------------------------------+------------+
| wait/io/file/innodb/innodb_log_file              |     100318 |
| wait/io/table/sql/handler                        |      99467 |
| idle                                             |      40356 |
| wait/io/file/csv/data                            |      35435 |
| wait/synch/mutex/innodb/flush_list_mutex         |      21618 |
| wait/synch/mutex/innodb/log_checkpointer_mutex   |      21392 |
| wait/io/file/innodb/innodb_data_file             |      11781 |
| wait/lock/table/sql/handler                      |       5755 |
| wait/synch/rwlock/sql/CRYPTO_dynlock_value::lock |       4350 |
| wait/synch/rwlock/mysqlx/client_list_clients     |       2850 |
+--------------------------------------------------+------------+
10 rows in set (0.02 sec)

mysql>
mysql> SELECT EVENT_NAME,SUM_TIMER_WAIT FROM events_waits_summary_global_by_event_name\
    -> ORDER BY SUM_TIMER_WAIT DESC LIMIT 10;
+---------------------------------------------------------+---------------------+
| EVENT_NAME                                              | SUM_TIMER_WAIT      |
+---------------------------------------------------------+---------------------+
| idle                                                    | 2069676763732908300 |
| wait/synch/cond/mysqlx/scheduler_dynamic_worker_pending |     360395379200736 |
| wait/io/file/innodb/innodb_data_file                    |       7409637663648 |
| wait/io/file/innodb/innodb_log_file                     |       6708792325488 |
| wait/io/table/sql/handler                               |       2256675014880 |
| wait/io/file/csv/data                                   |       1192798461888 |
| wait/io/file/sql/binlog                                 |        521064489264 |
| wait/lock/metadata/sql/mdl                              |        328708538400 |
| wait/io/file/innodb/innodb_temp_file                    |        103215665520 |
| wait/io/file/csv/metadata                               |         44341750464 |
+---------------------------------------------------------+---------------------+
10 rows in set (0.01 sec)

mysql>
mysql> SELECT * FROM file_instances limit 20;
+---------------------------------------------------------------------+--------------------------------------+------------+
| FILE_NAME                                                           | EVENT_NAME                           | OPEN_COUNT |
+---------------------------------------------------------------------+--------------------------------------+------------+
| C:\Program Files\MySQL\MySQL Server 8.0\share\english\errmsg.sys    | wait/io/file/sql/ERRMSG              |          0 |
| C:\Program Files\MySQL\MySQL Server 8.0\share\charsets\Index.xml    | wait/io/file/mysys/charset           |          0 |
| C:\ProgramData\MySQL\MySQL Server 8.0\Data\ibdata1                  | wait/io/file/innodb/innodb_data_file |          3 |
| C:\ProgramData\MySQL\MySQL Server 8.0\Data\ib_logfile0              | wait/io/file/innodb/innodb_log_file  |          2 |
| C:\ProgramData\MySQL\MySQL Server 8.0\Data\ib_logfile1              | wait/io/file/innodb/innodb_log_file  |          2 |
| C:\ProgramData\MySQL\MySQL Server 8.0\Data\undo_001                 | wait/io/file/innodb/innodb_data_file |          3 |
| C:\ProgramData\MySQL\MySQL Server 8.0\Data\undo_002                 | wait/io/file/innodb/innodb_data_file |          3 |
| C:\ProgramData\MySQL\MySQL Server 8.0\Data\ibtmp1                   | wait/io/file/innodb/innodb_data_file |          2 |
| C:\ProgramData\MySQL\MySQL Server 8.0\Data\#innodb_temp\temp_1.ibt  | wait/io/file/innodb/innodb_temp_file |          2 |
| C:\ProgramData\MySQL\MySQL Server 8.0\Data\#innodb_temp\temp_2.ibt  | wait/io/file/innodb/innodb_temp_file |          2 |
| C:\ProgramData\MySQL\MySQL Server 8.0\Data\#innodb_temp\temp_3.ibt  | wait/io/file/innodb/innodb_temp_file |          2 |
| C:\ProgramData\MySQL\MySQL Server 8.0\Data\#innodb_temp\temp_4.ibt  | wait/io/file/innodb/innodb_temp_file |          2 |
| C:\ProgramData\MySQL\MySQL Server 8.0\Data\#innodb_temp\temp_5.ibt  | wait/io/file/innodb/innodb_temp_file |          2 |
| C:\ProgramData\MySQL\MySQL Server 8.0\Data\#innodb_temp\temp_6.ibt  | wait/io/file/innodb/innodb_temp_file |          2 |
| C:\ProgramData\MySQL\MySQL Server 8.0\Data\#innodb_temp\temp_7.ibt  | wait/io/file/innodb/innodb_temp_file |          2 |
| C:\ProgramData\MySQL\MySQL Server 8.0\Data\#innodb_temp\temp_8.ibt  | wait/io/file/innodb/innodb_temp_file |          2 |
| C:\ProgramData\MySQL\MySQL Server 8.0\Data\#innodb_temp\temp_9.ibt  | wait/io/file/innodb/innodb_temp_file |          2 |
| C:\ProgramData\MySQL\MySQL Server 8.0\Data\#innodb_temp\temp_10.ibt | wait/io/file/innodb/innodb_temp_file |          2 |
| C:\ProgramData\MySQL\MySQL Server 8.0\Data\mysql.ibd                | wait/io/file/innodb/innodb_data_file |          3 |
| C:\ProgramData\MySQL\MySQL Server 8.0\Data\sys\sys_config.ibd       | wait/io/file/innodb/innodb_data_file |          1 |
+---------------------------------------------------------------------+--------------------------------------+------------+
20 rows in set (0.00 sec)

mysql>
本篇内容到这里就接近尾声了，相信很多人都认为，我们大多数时候并不会直接使用performance_schema来查询性能数据，
而是使用sys schema下的视图代替，为什么不直接学习sys schema呢？那你知道sys schema中的数据是从哪里吐出来的吗？
performance_schema 中的数据实际上主要是从performance_schema、information_schema中获取，所以要想玩转sys schema，
全面了解performance_schema必不可少。另外，对于sys schema、informatiion_schema甚至是mysql schema，
我们后续也会推出不同的系列文章分享给大家。 

“翻过这座山，你就可以看到一片海”，坚持阅读我们的performance_schema系列文章分享，你就可以系统地学完它。

下期将为大家分享 "performance_schema之二(配置表详解)" ，谢谢你的阅读，我们下期不见不散！
https://mp.weixin.qq.com/s/ELJhdttEo0q22bWlB8WveA
