https://dev.mysql.com/doc/refman/8.0/en/innodb-autocommit-commit-rollback.html
autocommit, Commit, and Rollback
https://dev.mysql.com/doc/refman/8.0/en/commit.html

mysql> delete from world.weather where Temperature = 20;
Query OK, 2 rows affected (0.11 sec)

mysql> select * from world.weather;
+------+------------+-------------+
| Id   | RecordDate | Temperature |
+------+------------+-------------+
|    1 | 2015-01-01 |          10 |
|    2 | 2015-01-02 |          25 |
|    4 | 2015-01-04 |          30 |
|    5 | 2018-11-21 |          17 |
|    6 | 2018-11-22 |          22 |
|    8 | 2018-11-24 |          18 |
+------+------------+-------------+
6 rows in set (0.00 sec)

mysql> delete from world.weather where Temperature >30 and Temperature <11;
Query OK, 0 rows affected (0.01 sec)

mysql> delete from world.weather where Temperature >30 or Temperature <11;
Query OK, 1 row affected (0.02 sec)

mysql> select * from world.weather;
+------+------------+-------------+
| Id   | RecordDate | Temperature |
+------+------------+-------------+
|    2 | 2015-01-02 |          25 |
|    4 | 2015-01-04 |          30 |
|    5 | 2018-11-21 |          17 |
|    6 | 2018-11-22 |          22 |
|    8 | 2018-11-24 |          18 |
+------+------------+-------------+
5 rows in set (0.00 sec)

mysql>



mysql> CREATE TABLE customer (a INT, b CHAR (20), INDEX (a));
Query OK, 0 rows affected (0.09 sec)

mysql> START TRANSACTION;
Query OK, 0 rows affected (0.00 sec)

mysql> INSERT INTO customer VALUES (10, 'Heikki');
Query OK, 1 row affected (0.01 sec)

mysql> INSERT INTO customer VALUES (20, 'Istvan');
Query OK, 1 row affected (0.00 sec)

mysql> INSERT INTO customer VALUES (30, 'Balint');
Query OK, 1 row affected (0.00 sec)

mysql> SET autocommit=0;
Query OK, 0 rows affected (0.01 sec)

mysql> INSERT INTO customer VALUES (15, 'John von numman');
Query OK, 1 row affected (0.00 sec)

mysql> INSERT INTO customer VALUES (20, 'Sandor');
Query OK, 1 row affected (0.00 sec)

mysql> DELETE FROM customer WHERE b = 'Heikki';
Query OK, 1 row affected (0.01 sec)

mysql> ROLLBACK;
Query OK, 0 rows affected (0.03 sec)

mysql> select * from customer;
Empty set (0.00 sec)

mysql> SELECT * FROM customer;
Empty set (0.00 sec)

mysql> INSERT INTO customer VALUES (20, 'Sandor');
Query OK, 1 row affected (0.01 sec)

mysql> select * from customer;
+------+--------+
| a    | b      |
+------+--------+
|   20 | Sandor |
+------+--------+
1 row in set (0.00 sec)

mysql> INSERT INTO customer VALUES (15, 'John von numman');
Query OK, 1 row affected (0.00 sec)

mysql> INSERT INTO customer VALUES (20, 'Istvan');
Query OK, 1 row affected (0.00 sec)

mysql> INSERT INTO customer VALUES (30, 'Balint');
Query OK, 1 row affected (0.00 sec)

mysql> select * from customer;
+------+-----------------+
| a    | b               |
+------+-----------------+
|   20 | Sandor          |
|   15 | John von numman |
|   20 | Istvan          |
|   30 | Balint          |
+------+-----------------+
4 rows in set (0.00 sec)

mysql> START TRANSACTION;
Query OK, 0 rows affected (0.05 sec)

mysql> INSERT INTO customer VALUES (10, 'Heikki');
Query OK, 1 row affected (0.01 sec)

mysql> select * from customer;
+------+-----------------+
| a    | b               |
+------+-----------------+
|   20 | Sandor          |
|   15 | John von numman |
|   20 | Istvan          |
|   30 | Balint          |
|   10 | Heikki          |
+------+-----------------+
5 rows in set (0.00 sec)

mysql> COMMIT;
Query OK, 0 rows affected (0.02 sec)

mysql> select * from customer;
+------+-----------------+
| a    | b               |
+------+-----------------+
|   20 | Sandor          |
|   15 | John von numman |
|   20 | Istvan          |
|   30 | Balint          |
|   10 | Heikki          |
+------+-----------------+
5 rows in set (0.00 sec)

mysql> select * from customer order by a;
+------+-----------------+
| a    | b               |
+------+-----------------+
|   10 | Heikki          |
|   15 | John von numman |
|   20 | Sandor          |
|   20 | Istvan          |
|   30 | Balint          |
+------+-----------------+
5 rows in set (0.00 sec)

mysql> SET autocommit=0;
Query OK, 0 rows affected (0.00 sec)

mysql> INSERT INTO customer VALUES (40, 'Lila');
Query OK, 1 row affected (0.01 sec)

mysql> DELETE FROM customer WHERE b = 'Heikki';
Query OK, 1 row affected (0.01 sec)

mysql> select * from customer;
+------+-----------------+
| a    | b               |
+------+-----------------+
|   20 | Sandor          |
|   15 | John von numman |
|   20 | Istvan          |
|   30 | Balint          |
|   40 | Lila            |
+------+-----------------+
5 rows in set (0.00 sec)

mysql> select * from customer order by a;
+------+-----------------+
| a    | b               |
+------+-----------------+
|   15 | John von numman |
|   20 | Sandor          |
|   20 | Istvan          |
|   30 | Balint          |
|   40 | Lila            |
+------+-----------------+
5 rows in set (0.00 sec)

mysql> ROLLBACK;
Query OK, 0 rows affected (0.09 sec)

mysql> SELECT * FROM customer;
+------+-----------------+
| a    | b               |
+------+-----------------+
|   20 | Sandor          |
|   15 | John von numman |
|   20 | Istvan          |
|   30 | Balint          |
|   10 | Heikki          |
+------+-----------------+
5 rows in set (0.00 sec)

mysql> select * from customer order by a;
+------+-----------------+
| a    | b               |
+------+-----------------+
|   10 | Heikki          |
|   15 | John von numman |
|   20 | Sandor          |
|   20 | Istvan          |
|   30 | Balint          |
+------+-----------------+
5 rows in set (0.00 sec)

mysql> INSERT INTO customer VALUES (40, 'Lila');
Query OK, 1 row affected (0.01 sec)

mysql> select * from customer order by a;
+------+-----------------+
| a    | b               |
+------+-----------------+
|   10 | Heikki          |
|   15 | John von numman |
|   20 | Sandor          |
|   20 | Istvan          |
|   30 | Balint          |
|   40 | Lila            |
+------+-----------------+
6 rows in set (0.00 sec)

mysql> ROLLBACK;
Query OK, 0 rows affected (0.09 sec)

mysql> select * from customer order by a;
+------+-----------------+
| a    | b               |
+------+-----------------+
|   10 | Heikki          |
|   15 | John von numman |
|   20 | Sandor          |
|   20 | Istvan          |
|   30 | Balint          |
+------+-----------------+
5 rows in set (0.00 sec)

mysql> INSERT INTO customer VALUES (40, 'Lila');
Query OK, 1 row affected (0.01 sec)

mysql> INSERT INTO customer VALUES (40, 'Lila');
Query OK, 1 row affected (0.00 sec)

mysql> select * from customer order by a;
+------+-----------------+
| a    | b               |
+------+-----------------+
|   10 | Heikki          |
|   15 | John von numman |
|   20 | Sandor          |
|   20 | Istvan          |
|   30 | Balint          |
|   40 | Lila            |
|   40 | Lila            |
+------+-----------------+
7 rows in set (0.00 sec)

mysql> ROLLBACK;
Query OK, 0 rows affected (0.02 sec)

mysql> select * from customer order by a;
+------+-----------------+
| a    | b               |
+------+-----------------+
|   10 | Heikki          |
|   15 | John von numman |
|   20 | Sandor          |
|   20 | Istvan          |
|   30 | Balint          |
+------+-----------------+
5 rows in set (0.00 sec)

mysql> select * from customer order by a;
+------+-----------------+
| a    | b               |
+------+-----------------+
|   10 | Heikki          |
|   15 | John von numman |
|   20 | Sandor          |
|   20 | Istvan          |
|   30 | Balint          |
+------+-----------------+
5 rows in set (0.00 sec)

mysql> COMMIT;
Query OK, 0 rows affected (0.00 sec)

mysql> select * from customer order by a;
+------+-----------------+
| a    | b               |
+------+-----------------+
|   10 | Heikki          |
|   15 | John von numman |
|   20 | Sandor          |
|   20 | Istvan          |
|   30 | Balint          |
+------+-----------------+
5 rows in set (0.00 sec)

mysql> ROLLBACK;
Query OK, 0 rows affected (0.00 sec)

mysql> select * from customer order by a;
+------+-----------------+
| a    | b               |
+------+-----------------+
|   10 | Heikki          |
|   15 | John von numman |
|   20 | Sandor          |
|   20 | Istvan          |
|   30 | Balint          |
+------+-----------------+
5 rows in set (0.00 sec)

mysql>



mysql> create table t(a int, primary key (a))engine=innodb;
Query OK, 0 rows affected (0.09 sec)

mysql> select @@autocommit;
+--------------+
| @@autocommit |
+--------------+
|            0 |
+--------------+
1 row in set (0.01 sec)

mysql>  set @@completion_type=1;
Query OK, 0 rows affected (0.01 sec)

mysql> begin;
Query OK, 0 rows affected (0.00 sec)

mysql> insert into t select 1;
Query OK, 1 row affected (0.01 sec)
Records: 1  Duplicates: 0  Warnings: 0

mysql> commit work;
Query OK, 0 rows affected (0.02 sec)

mysql>  insert into t select 2;
Query OK, 1 row affected (0.01 sec)
Records: 1  Duplicates: 0  Warnings: 0

mysql> insert into t select 2;
ERROR 1062 (23000): Duplicate entry '2' for key 'PRIMARY'
mysql> rollback;
Query OK, 0 rows affected (0.04 sec)

mysql>  select * from t;
+---+
| a |
+---+
| 1 |
+---+
1 row in set (0.00 sec)

mysql>

